{
  "$schema": "https://json-schema.org/draft/2020-12/schema",
  "type": "object",
  "required": [
    "schema_version",
    "topic_id",
    "version",
    "predicates",
    "selection_is_not_booking",
    "real_payment_is_not_performed"
  ],
  "properties": {
    "schema_version": {
      "const": "1.0"
    },
    "topic_id": {
      "const": "ride_booking"
    },
    "version": {
      "const": 1
    },
    "predicates": {
      "type": "object",
      "required": [
        "correct_booking_committed"
      ]
    },
    "selection_is_not_booking": {
      "const": true
    },
    "real_payment_is_not_performed": {
      "const": true
    }
  },
  "additionalProperties": false
}
