{
  "schema_version": "1.0",
  "topic_id": "ride_booking",
  "version": 1,
  "predicates": {
    "correct_booking_committed": {
      "journey_stage": "5",
      "screen": "ride_booked",
      "ride_confirmed": "true",
      "ride_cancelled": "false"
    }
  },
  "selection_is_not_booking": true,
  "real_payment_is_not_performed": true
}
